{
  "calendar_year": 2014,
  "summary": "反腐纵深、APEC蓝、沪港通。。这一年中国大陆的社会经济文化脉络，为平行人生叙事提供真实时代锚点。",
  "social_mood": "新常态提法落地，增长换挡期共识形成。。普通人在新闻与日常之间，感知到的情绪与压力真实可触。",
  "atmosphere": {
    "gdp_trillion_cny": 64.4,
    "gdp_growth_pct": 7.4,
    "cpi_pct": 2,
    "gaokao_candidates_wan": 939,
    "college_graduates_wan": 727,
    "internet_users_yi": 6.49,
    "mobile_users_yi": 12.5,
    "housing_price_index_70_cities_pct": 5.9,
    "migrant_workers_wan": 16800,
    "avg_urban_disposable_income_cny": 28844,
    "rural_net_income_cny": 9892,
    "foreign_reserves_usd_trillion": 3.84,
    "dominant_anxiety": "新常态提法落地",
    "employment_pressure": "毕业生727万与城镇调查失业率受关注",
    "education_hotspot": "高考939万，考研与考公热度",
    "policy_keyword": "反腐纵深、APEC蓝、沪港通。",
    "international_shadow": "全球宏观与国内结构性矛盾交织",
    "meme_keywords": [
      "且行且珍惜",
      "冰桶挑战",
      "A股"
    ]
  },
  "pop_culture": [
    "奔跑吧兄弟",
    "来自星星的你",
    "小苹果（流行文化）",
    "A股牛市",
    "微信红包",
    "冰桶挑战",
    "后会无期",
    "柴静余温",
    "阿里巴巴上市",
    "LeTV生态",
    "占中讨论",
    "TFBOYS"
  ],
  "macro_events": [
    {
      "category": "politics_policy",
      "title": "APEC北京",
      "detail": "2014年11月APEC峰会在北京举行，APEC蓝刷屏。",
      "source_url": "https://zh.wikipedia.org/zh-hans/%E4%B8%AD%E5%9B%BD",
      "weight": 1,
      "sensitivity": "low",
      "tags": []
    },
    {
      "category": "economy",
      "title": "新常态",
      "detail": "2014年习近平提出经济发展新常态。。该事件在当年社会舆论与青年生活中留有清晰印记。",
      "source_url": "https://www.stats.gov.cn/sj/tjgb/",
      "weight": 1,
      "sensitivity": "low",
      "tags": []
    },
    {
      "category": "tech_internet",
      "title": "阿里巴巴IPO",
      "detail": "2014年9月阿里巴巴纽交所上市。。该事件在当年社会舆论与青年生活中留有清晰印记。",
      "source_url": "https://zh.wikipedia.org/zh-hans/%E4%B8%AD%E5%9B%BD",
      "weight": 1,
      "sensitivity": "low",
      "tags": []
    },
    {
      "category": "politics_policy",
      "title": "反腐纵深",
      "detail": "2014年周永康等高级干部被查。。该事件在当年社会舆论与青年生活中留有清晰印记。",
      "source_url": "https://zh.wikipedia.org/zh-hans/%E4%B8%AD%E5%9B%BD",
      "weight": 1,
      "sensitivity": "low",
      "tags": []
    },
    {
      "category": "society",
      "title": "沪港通",
      "detail": "2014年11月沪港通启动。。该事件在当年社会舆论与青年生活中留有清晰印记。",
      "source_url": "https://zh.wikipedia.org/zh-hans/%E4%B8%AD%E5%9B%BD",
      "weight": 1,
      "sensitivity": "low",
      "tags": []
    },
    {
      "category": "culture_entertainment",
      "title": "小苹果",
      "detail": "2014年筷子兄弟《小苹果》现象级传播。",
      "source_url": "https://zh.wikipedia.org/zh-hans/%E4%B8%AD%E5%9B%BD",
      "weight": 1,
      "sensitivity": "low",
      "tags": []
    },
    {
      "category": "disaster_crisis",
      "title": "昆山8·2爆炸",
      "detail": "2014年8月2日昆山中荣工厂爆炸68人遇难。",
      "source_url": "https://zh.wikipedia.org/zh-hans/%E4%B8%AD%E5%9B%BD",
      "weight": 1,
      "sensitivity": "high",
      "tags": []
    },
    {
      "category": "housing",
      "title": "限购松绑",
      "detail": "2014年多地取消或放松限购。。该事件在当年社会舆论与青年生活中留有清晰印记。",
      "source_url": "https://zh.wikipedia.org/zh-hans/%E4%B8%AD%E5%9B%BD",
      "weight": 1,
      "sensitivity": "low",
      "tags": []
    },
    {
      "category": "tech_internet",
      "title": "微信红包",
      "detail": "2014年春节微信红包引发移动支付大战。",
      "source_url": "https://zh.wikipedia.org/zh-hans/%E4%B8%AD%E5%9B%BD",
      "weight": 1,
      "sensitivity": "low",
      "tags": []
    },
    {
      "category": "employment",
      "title": "727万毕业生",
      "detail": "2014届727万。。该事件在当年社会舆论与青年生活中留有清晰印记。",
      "source_url": "https://zh.wikipedia.org/zh-hans/%E4%B8%AD%E5%9B%BD",
      "weight": 1,
      "sensitivity": "low",
      "tags": []
    },
    {
      "category": "urban_life",
      "title": "单独二孩",
      "detail": "2014年单独二孩政策启动。。该事件在当年社会舆论与青年生活中留有清晰印记。",
      "source_url": "https://zh.wikipedia.org/zh-hans/%E4%B8%AD%E5%9B%BD",
      "weight": 1,
      "sensitivity": "low",
      "tags": []
    },
    {
      "category": "education",
      "title": "考试招生改革",
      "detail": "2014年9月国务院印发考试招生制度改革意见。",
      "source_url": "https://zh.wikipedia.org/zh-hans/%E4%B8%AD%E5%9B%BD",
      "weight": 1,
      "sensitivity": "low",
      "tags": []
    },
    {
      "category": "economy",
      "title": "2014年GDP约64.4万亿元",
      "detail": "2014年中国国内生产总值约64.4万亿元，比上年增长7.4%，CPI约2.0%。",
      "source_url": "https://www.stats.gov.cn/sj/tjgb/",
      "weight": 1.2,
      "sensitivity": "low",
      "tags": []
    },
    {
      "category": "education",
      "title": "2014年高考939万人",
      "detail": "2014年全国高考报名约939万人，高校毕业生约727万人。",
      "source_url": "https://www.moe.gov.cn/jyb_xwfb/",
      "weight": 1,
      "sensitivity": "low",
      "tags": []
    },
    {
      "category": "tech_internet",
      "title": "2014年网民6.49亿",
      "detail": "2014年中国网民规模约6.49亿，移动电话用户约12.5亿。",
      "source_url": "https://www.cnnic.cn/n4/2024/0902/166-18798.htm",
      "weight": 0.9,
      "sensitivity": "low",
      "tags": []
    },
    {
      "category": "employment",
      "title": "2014年农民工16800万",
      "detail": "2014年全国农民工总量约16800万人。",
      "source_url": "https://www.stats.gov.cn/sj/tjgb/",
      "weight": 0.8,
      "sensitivity": "low",
      "tags": []
    },
    {
      "category": "housing",
      "title": "2014年70城房价指数",
      "detail": "2014年70个大中城市新建住宅价格同比约5.9%。",
      "source_url": "https://www.stats.gov.cn/sj/tjgb/",
      "weight": 0.9,
      "sensitivity": "low",
      "tags": []
    },
    {
      "category": "economy",
      "title": "2014年外汇储备",
      "detail": "2014年末外汇储备约3.84万亿美元。",
      "source_url": "https://www.stats.gov.cn/sj/tjgb/",
      "weight": 0.7,
      "sensitivity": "low",
      "tags": []
    },
    {
      "category": "employment",
      "title": "2014年就业市场体感",
      "detail": "毕业生727万与城镇调查失业率受关注；城镇新增就业与高校毕业生约727万叠加，「先就业再择业」成为常见策略。",
      "source_url": "https://www.stats.gov.cn/sj/tjgb/",
      "weight": 1.1,
      "sensitivity": "low",
      "tags": [
        "employment",
        "graduate"
      ]
    },
    {
      "category": "housing",
      "title": "2014年房价指数约5.9%",
      "detail": "70个大中城市新建住宅价格同比约5.9%；首套与二套政策、公积金与按揭利率牵动刚需与改善群体。",
      "source_url": "https://www.stats.gov.cn/sj/tjgb/",
      "weight": 1.2,
      "sensitivity": "low",
      "tags": [
        "housing",
        "mortgage"
      ]
    },
    {
      "category": "education",
      "title": "2014年高考约939万考生",
      "detail": "高考报名约939万人；高考939万，考研与考公热度持续升温，家庭在教育支出上的机会成本讨论增多。",
      "source_url": "https://www.moe.gov.cn/",
      "weight": 1,
      "sensitivity": "low",
      "tags": [
        "gaokao",
        "education"
      ]
    },
    {
      "category": "tech_internet",
      "title": "2014年网民约6.49亿",
      "detail": "CNNIC统计网民约6.49亿、手机用户约12.5亿；移动支付、短视频与平台经济渗透日常生活。",
      "source_url": "https://www.cnnic.cn/hlwfzyj/hlwxzbg/",
      "weight": 1,
      "sensitivity": "low",
      "tags": [
        "internet",
        "mobile"
      ]
    },
    {
      "category": "society",
      "title": "2014年城乡收入差距",
      "detail": "城镇人均可支配收入约28844元、农村约9892元；进城务工约16800万，户籍与公共服务均等化仍是议题。",
      "source_url": "https://www.stats.gov.cn/sj/tjgb/",
      "weight": 0.9,
      "sensitivity": "low",
      "tags": [
        "income",
        "rural"
      ]
    },
    {
      "category": "society",
      "title": "2014年社会焦虑主轴",
      "detail": "舆论与家庭谈话中「新常态提法落地」高频出现，影响婚育、职业选择与地域流动决策。",
      "source_url": "https://www.gov.cn/",
      "weight": 1,
      "sensitivity": "low",
      "tags": [
        "anxiety",
        "mood"
      ]
    },
    {
      "category": "politics_policy",
      "title": "2014年政策关键词：反腐纵深、APEC蓝、沪港通。",
      "detail": "年度政策与规划表述围绕「反腐纵深、APEC蓝、沪港通。」展开，地方落实通过项目、补贴与考核机制触达居民。",
      "source_url": "https://www.gov.cn/",
      "weight": 0.9,
      "sensitivity": "low",
      "tags": [
        "policy"
      ]
    },
    {
      "category": "urban_life",
      "title": "2014年通勤与地铁扩张",
      "detail": "多城地铁新线开通或延伸，「TOD」「一小时通勤圈」进入租房决策；高峰拥挤成本计入生活账。",
      "source_url": "https://www.stats.gov.cn/sj/tjgb/",
      "weight": 0.8,
      "sensitivity": "low",
      "tags": [
        "transit",
        "urban"
      ]
    },
    {
      "category": "society",
      "title": "2014年家庭催婚催育压力",
      "detail": "春节与节假日聚会中，就业、买房、结婚、生育成亲戚问答清单；代际价值观冲突在饭桌上显性化。",
      "source_url": "https://www.stats.gov.cn/sj/tjgb/",
      "weight": 1,
      "sensitivity": "low",
      "tags": [
        "family",
        "marriage"
      ]
    },
    {
      "category": "economy",
      "title": "2014年理财与负债",
      "detail": "房贷、消费贷与货币基金/基金定投并存；利率变动与资产价格波动影响中产资产负债表。",
      "source_url": "https://www.pbc.gov.cn/",
      "weight": 0.9,
      "sensitivity": "low",
      "tags": [
        "finance",
        "debt"
      ]
    },
    {
      "category": "culture_entertainment",
      "title": "2014年网络迷因：且行且珍惜",
      "detail": "「且行且珍惜」等梗在社交媒体二次传播，构成同龄人文化暗号与情绪出口。",
      "source_url": "https://www.cnnic.cn/hlwfzyj/hlwxzbg/",
      "weight": 0.7,
      "sensitivity": "low",
      "tags": [
        "meme",
        "culture"
      ]
    },
    {
      "category": "society",
      "title": "2014年医疗与体检",
      "detail": "医保异地结算、集采降价持续推进；年轻人「体检报告焦虑」与加班文化交织。",
      "source_url": "https://www.gov.cn/",
      "weight": 0.9,
      "sensitivity": "medium",
      "tags": [
        "healthcare"
      ]
    },
    {
      "category": "employment",
      "title": "2014年灵活就业与平台用工",
      "detail": "外卖、网约车、直播带货等吸纳大量灵活就业；社保衔接与劳动权益保障讨论不断。",
      "source_url": "https://www.stats.gov.cn/sj/tjgb/",
      "weight": 1,
      "sensitivity": "low",
      "tags": [
        "gig",
        "labor"
      ]
    },
    {
      "category": "housing",
      "title": "2014年租赁市场",
      "detail": "一线与新一线租金占收入比上升，合租、群租治理与「青年公寓」政策并存，流动青年「住」的稳定性不足。",
      "source_url": "https://www.stats.gov.cn/sj/tjgb/",
      "weight": 1,
      "sensitivity": "low",
      "tags": [
        "rent"
      ]
    },
    {
      "category": "tech_internet",
      "title": "2014年数字生活",
      "detail": "扫码支付、网约车、外卖、在线会议/网课成为基础设施；算法推荐塑造信息茧房与消费路径。",